{
  "$schema": "../../../schema/kr-content-overlay.schema.json",
  "contentKind": "source-grounded-draft",
  "subjectKorean": "수학",
  "authoredAt": "2026-09-05",
  "sourceRefs": ["kr-ncic-math-pdf-2022"],
  "note": "테스트 픽스처. 실제 콘텐츠가 아니라 병합·검증 경로를 확인하는 표본이다.",
  "entries": {
    "kr.mt.math.number-operations.g1-2.s2-01-01.concept": {
      "evidence": [
        "수 모형으로 세 자리 수를 낱개·십·백 묶음으로 갈라 세고, 같은 수를 두 가지 방법으로 나타내어 설명한다.",
        "교실 물건의 개수를 어림한 뒤 실제로 세어 보고, 어림한 값과 센 값의 차이를 비교해 말한다."
      ],
      "assessmentPrompt": "수 모형과 빈 수직선을 주고 세 자리 수 하나를 여러 방법으로 나타내게 한 뒤, 어떤 방법이 왜 편리한지 근거를 들어 설명하게 한다.",
      "misconceptions": [
        "자리의 값을 무시하고 숫자를 크기 순으로만 읽는 오류",
        "0이 들어간 자리를 건너뛰고 읽거나 쓰는 오류"
      ],
      "sourceLocator": {
        "sourceId": "kr-ncic-math-pdf-2022",
        "printedPage": 12,
        "section": "수와 연산 영역 성취기준"
      }
    }
  }
}
